Bus Hound 6.01 capture on Windows Vista Service Pack 1 (x64). Complements of www.perisoft.net

  Device - Device ID (followed by the endpoint for USB devices)
            (27) USB Serial Port (COM17)
            (49) USB Composite Device
            (54) USB Serial Port
            (55) USB Input Device
            (58) HID-compliant device
  Length - Total transfer length
  Phase  - Phase Type
            IN    Data in transfer           
            OUT   Data out transfer          
  Data   - Hex dump of the data transferred
  Descr  - Description of the phase
  Cmd... - Position in the captured data


Device  Length    Phase  Data                                                                                                    Description                       Cmd.Phase.Ofs(rep)
------  --------  -----  ------------------------------------------------------------------------------------------------------  --------------------------------  ------------------
  27           4  OUT    01 05 10 00                                                                                             ....                                     1.1.0        
  27          14  IN     04 0e 0b 01  05 10 00 00  01 30 02 00  0a 00                                                            .........0....                           2.1.0        
  27          11  OUT    01 33 0c 07  01 00 02 03  00 04 00                                                                      .3.........                              3.1.0        
  27           7  IN     04 0e 04 01  33 0c 00                                                                                   ....3..                                  4.1.0        
  27          17  OUT    01 05 04 0d  00 00 00 00  00 00 00 00  00 00 00 00  00                                                  .................                        5.1.0        
  27          21  IN     04 0f 04 00  01 05 04 04  03 0b 00 ff  0f 00 00 00  00 00 00 01  00                                     .....................                    6.1.0        
  27          12  OUT    02 ff 0f 07  00 00 01 03  00 01 03 00                                                                   ............                             7.1.0        
  27          19  IN     04 13 05 01  ff 0f 01 00  02 ff 0f 06  00 00 01 02  00 00 00                                            ...................                      8.1.0        
  27          19  OUT    02 ff 0f 0e  00 12 01 0a  00 01 03 00  00 00 00 00  00 00 00                                            ...................                      9.1.0        
  27          21  IN     04 13 05 01  ff 0f 01 00  02 ff 0f 0e  00 12 01 0a  00 00 00 00  00                                     .....................                   10.1.0        
  27           6  IN     00 00 00 00  00 00                                                                                      ......                                  11.1.0        
  27          19  OUT    02 ff 0f 0e  00 12 01 0a  00 01 03 00  00 00 00 00  10 00 00                                            ...................                     12.1.0        
  27          27  IN     04 13 05 01  ff 0f 01 00  02 ff 0f 0e  00 12 01 0a  00 00 00 00  00 00 00 00  00 00 00                  ...........................             13.1.0        
  27         255  OUT    02 ff 0f fa  00 11 01 f6  80 01 03 00  00 00 00 00  10 00 00 02  06 bf 02 00  09 b4 02 00  07 da 02 00  ................................        14.1.0        
                         0a ac 02 00  06 bf 02 00  09 b4 08 38  c8 f8 02 00  0a ba 74 07  c0 e0 74 00  c0 e0 32 d2  82 22 02 00  ...........8......t...t...2.."..        14.1.32       
                         0a b9 8e 83  8f 82 75 93  00 ea 70 03  eb 60 0d eb  60 03 ea 04  fa ed f0 a3  db fb da f9  22 22 02 00  ......u...p..`..`...........""..        14.1.64       
                         09 f3 8e 83  8f 82 75 93  00 eb 60 05  ed f0 a3 db  fb 22 02 04  17 47 02 00  0a ba eb 70  08 e7 09 f6  ......u...`......"...G.....p....        14.1.96       
                         08 df fa 80  1b 89 82 8a  83 14 10 e7  0a f5 93 e0  a3 f6 08 df  fa 80 09 f5  93 e4 93 a3  f6 08 df f9  ................................        14.1.128      
                         ec fa a9 f0  ed fb 22 88  f0 ef 60 01  0e 4e 60 f0  88 f0 ed 60  c5 14 10 e7  e7 cb 70 0e  88 82 8c 83  ......"...`..N`....`......p.....        14.1.160      
                         8b 93 e7 09  f0 a3 df fa  80 d6 14 10  e7 2a 89 82  8a 83 f5 93  ec fa e0 a3  c8 c5 82 c8  cc c5 83 cc  .............*..................        14.1.192      
                         cb c5 93 cb  f0 a3 c8 c5  82 c8 cc c5  83 cc cb c5  93 cb df e2  de e0 80 aa  89 82 8a 83  f5 93 ec     ...............................         14.1.224      
  27          19  IN     04 13 05 01  ff 0f 01 00  02 ff 0f 06  00 11 01 02  00 00 00                                            ...................                     15.1.0        
  27         255  OUT    02 ff 0f fa  00 01 00 f6  80 fa e4 93  a3 c8 c5 82  c8 cc c5 83  cc cb c5 93  cb f0 a3 c8  c5 82 c8 cc  ................................        16.1.0        
                         c5 83 cc cb  c5 93 cb df  e1 de df 02  00 00 8f eb  70 02 e7 22  89 82 8a 83  14 10 e7 04  f5 93 e0 22  ................p.."..........."        16.1.32       
                         f5 93 e4 93  22 bb 00 02  f7 22 bb 80  00 50 09 89  82 8a 83 8b  93 15 93 f0  22 ef 8d f0  a4 a8 f0 cf  ...."...."...P..........".......        16.1.64       
                         8c f0 a4 28  ce 8d f0 a4  2e fe 22 bc  00 0b be 00  29 ef 8d f0  84 ff ad f0  22 e4 cc f8  75 f0 08 ef  ...(......".....)......."...u...        16.1.96       
                         2f ff ee 33  fe ec 33 fc  ee 9d ec 98  40 05 fc ee  9d fe 0f d5  f0 e9 e4 ce  fd 22 ed f8  f5 f0 ee 00  /..3..3.....@............"......        16.1.128      
                         84 20 d2 1c  fe ad f0 75  f0 08 ef 2f  ff ed 33 fd  40 07 98 50  06 d5 f0 f2  22 c3 98 fd  0f d5 f0 ea  . .....u.../..3.@..P....".......        16.1.160      
                         22 c5 f0 f8  a3 e0 28 f0  c5 f0 f8 e5  82 15 82 70  02 15 83 e0  38 f0 22 a3  f8 e0 c5 f0  25 f0 f0 e5  ".....(........p....8.".....%...        16.1.192      
                         82 15 82 70  02 15 83 e0  c8 38 f0 e8  22 eb 70 07  e7 f5 f0 09  e7 19 22 89  82 8a 83 14  10 e7 08     ...p.....8..".p......."........         16.1.224      
  27         255  OUT    02 ff 0f fa  00 01 00 f6  80 f5 93 e0  f5 f0 a3 e0  22 f5 93 e4  93 f5 f0 74  01 93 22 bb  00 06 f7 09  ................"......t..".....        17.1.0        
                         a7 f0 19 22  bb 80 00 50  0d 89 82 8a  83 8b 93 15  93 f0 e5 f0  a3 f0 22 ef  2b ff ee 3a  fe ed 39 fd  ..."...P..............".+..:..9.        17.1.32       
                         ec 38 fc 22  c3 ef 9b ff  ee 9a fe ed  99 fd ec 98  fc 22 e8 8f  f0 a4 cc 8b  f0 a4 2c fc  e9 8e f0 a4  .8."............."........,.....        17.1.64       
                         2c fc 8a f0  ed a4 2c fc  ea 8e f0 a4  cd a8 f0 8b  f0 a4 2d cc  38 25 f0 fd  e9 8f f0 a4  2c cd 35 f0  ,.....,...........-.8%......,.5.        17.1.96       
                         fc eb 8e f0  a4 fe a9 f0  eb 8f f0 a4  cf c5 f0 2e  cd 39 fe e4  3c fc ea a4  2d ce 35 f0  fd e4 3c fc  .................9..<...-.5...<.        17.1.128      
                         22 75 f0 08  75 82 00 ef  2f ff ee 33  fe cd 33 cd  cc 33 cc c5  82 33 c5 82  9b ed 9a ec  99 e5 82 98  "u..u.../..3..3..3...3..........        17.1.160      
                         40 0c f5 82  ee 9b fe ed  9a fd ec 99  fc 0f d5 f0  d6 e4 ce fb  e4 cd fa e4  cc f9 a8 82  22 b8 00 c1  @..........................."...        17.1.192      
                         b9 00 59 ba  00 2d ec 8b  f0 84 cf ce  cd fc e5 f0  cb f9 78 18  ef 2f ff ee  33 fe ed 33  fd ec 33     ..Y..-............x../..3..3..3         17.1.224      
  27         255  OUT    02 ff 0f fa  00 01 00 f6  80 fc eb 33  fb 10 d7 03  99 40 04 eb  99 fb 0f d8  e5 e4 f9 fa  22 78 18 ef  ...........3.....@.........."x..        18.1.0        
                         2f ff ee 33  fe ed 33 fd  ec 33 fc c9  33 c9 10 d7  05 9b e9 9a  40 07 ec 9b  fc e9 9a f9  0f d8 e0 e4  /..3..3..3..3.......@...........        18.1.32       
                         c9 fa e4 cc  fb 22 75 f0  10 ef 2f ff  ee 33 fe ed  33 fd cc 33  cc c8 33 c8  10 d7 07 9b  ec 9a e8 99  ....."u.../..3..3..3..3.........        18.1.64       
                         40 0a ed 9b  fd ec 9a fc  e8 99 f8 0f  d5 f0 da e4  cd fb e4 cc  fa e4 c8 f9  22 ef 5b ff  ee 5a fe ed  @.......................".[..Z..        18.1.96       
                         59 fd ec 58  fc 22 ef 4b  ff ee 4a fe  ed 49 fd ec  48 fc 22 ef  6b ff ee 6a  fe ed 69 fd  ec 68 fc 22  Y..X.".K..J..I..H.".k..j..i..h."        18.1.128      
                         cf f4 cf ce  f4 ce cd f4  cd cc f4 cc  22 eb 9f f5  f0 ea 9e 42  f0 e9 9d 42  f0 ec 64 80  c8 64 80 98  ............"......B...B..d..d..        18.1.160      
                         45 f0 22 eb  9f f5 f0 ea  9e 42 f0 e9  9d 42 f0 e8  9c 45 f0 22  e8 60 0f ec  c3 13 fc ed  13 fd ee 13  E."......B...B...E.".`..........        18.1.192      
                         fe ef 13 ff  d8 f1 22 e8  60 0f ef c3  33 ff ee 33  fe ed 33 fd  ec 33 fc d8  f1 22 eb 70  06 e9 f8     ......".`...3..3..3..3...".p...         18.1.224      
  27         255  OUT    02 ff 0f fa  00 01 00 f6  80 02 00 05  95 89 82 8a  83 14 10 e7  06 f5 93 02  00 04 01 f5  93 02 00 04  ................................        19.1.0        
                         19 bb 00 06  e9 f8 02 00  05 a1 bb 80  00 50 0c 89  82 8a 83 8b  93 15 93 02  00 04 42 22  e0 fc a3 e0  .............P............B"....        19.1.32       
                         fd a3 e0 fe  a3 e0 ff 22  e2 fc 08 e2  fd 08 e2 fe  08 e2 ff 22  e4 93 fc 74  01 93 fd 74  02 93 fe 74  ......."..........."...t...t...t        19.1.64       
                         03 93 ff 22  e0 f8 a3 e0  f9 a3 e0 fa  a3 e0 fb 22  e2 fb 08 e2  f9 08 e2 fa  08 e2 cb f8  22 ec f0 a3  ..."..........."............"...        19.1.96       
                         ed f0 a3 ee  f0 a3 ef f0  22 ec f2 08  ed f2 08 ee  f2 08 ef f2  22 a4 25 82  f5 82 e5 f0  35 83 f5 83  ........"...........".%.....5...        19.1.128      
                         22 e0 fb a3  e0 fa a3 e0  f9 22 f8 e0  fb a3 a3 e0  f9 25 f0 f0  e5 82 15 82  70 02 15 83  e0 fa 38 f0  "........".......%......p.....8.        19.1.160      
                         22 eb f0 a3  ea f0 a3 e9  f0 22 e2 fb  08 e2 fa 08  e2 f9 22 eb  f2 08 ea f2  08 e9 f2 22  bb 00 1c d0  "........"........"........"....        19.1.192      
                         93 d0 f0 d0  e0 f8 d0 e0  c9 fb d0 e0  fa d0 e0 cb  c8 c0 e0 c0  f0 c0 93 02  00 05 ad bb  80 00 50     ..............................P         19.1.224      
  27         255  OUT    02 ff 0f fa  00 01 00 f6  80 22 d0 93  d0 f0 d0 e0  f8 d0 e0 c9  f5 82 d0 e0  ca f5 83 d0  e0 cb 14 c8  ........."......................        20.1.0        
                         c0 e0 c0 f0  c0 93 88 93  02 00 04 86  d0 93 d0 83  d0 82 d0 e0  d0 e0 d0 e0  e4 73 d0 93  d0 83 d0 82  .........................s......        20.1.32       
                         f8 e4 93 70  12 74 01 93  70 0d a3 a3  93 f8 74 01  93 f5 82 88  83 e4 73 74  02 93 68 60  ef a3 a3 a3  ...p.t..p.....t.......st..h`....        20.1.64       
                         80 df d0 93  d0 83 d0 82  f8 e4 93 70  12 74 01 93  70 0d a3 a3  93 f8 74 01  93 f5 82 88  83 e4 73 74  ...........p.t..p.....t.......st        20.1.96       
                         02 93 b5 f0  06 74 03 93  68 60 e9 a3  a3 a3 a3 80  d8 d0 93 d0  83 d0 82 e4  93 70 12 74  01 93 70 0d  .....t..h`...............p.t..p.        20.1.128      
                         a3 a3 93 f8  74 01 93 f5  82 88 83 e4  73 74 02 93  6c 70 12 74  03 93 6d 70  0c 74 04 93  6e 70 06 74  ....t.......st..lp.t..mp.t..np.t        20.1.160      
                         05 93 6f 60  dd a3 a3 a3  a3 a3 a3 80  ca 8b 93 8a  83 89 82 15  93 53 93 7f  e4 73 e6 fc  08 e6 fd 08  ..o`.................S...s......        20.1.192      
                         e6 fe 08 e6  ff 22 ec f6  08 ed f6 08  ee f6 08 ef  f6 22 eb f6  08 ea f6 08  e9 f6 22 8e  83 8f 82     ....."..........."........"....         20.1.224      
  27         255  OUT    02 ff 0f fa  00 01 00 f6  80 75 93 00  e0 ff a3 e0  fe a3 e0 fd  a3 e0 90 01  1c 0c f0 a3  75 86 01 90  .........u..................u...        21.1.0        
                         01 18 11 75  86 00 ed f0  a3 75 86 01  f0 a3 75 86  00 ee f0 a3  75 86 01 f0  a3 75 86 00  ef f0 a3 75  ...u.....u....u.....u....u.....u        21.1.32       
                         86 01 f0 75  86 00 22 00  01 43 43 c7  c7 c7 c7 00  00 00 00 00  00 22 02 03  f8 d9 e4 93  a3 f8 54 07  ...u.."..CC.........."........T.        21.1.64       
                         24 0c c8 c3  33 c4 54 0f  44 20 c8 83  40 04 f4 56  80 01 46 f6  df e4 80 0c  01 02 04 08  10 20 40 80  $...3.T.D ..@..V..F.......... @.        21.1.96       
                         90 00 08 28  e4 7e 01 93  60 cc a3 ff  54 3f 30 e5  09 54 1f fe  e4 93 a3 60  01 0e cf 54  e0 b4 e0 29  ...(....`...T?0..T.....`...T...)        21.1.128      
                         e4 93 fb a3  e4 93 fa a3  e4 93 f9 a3  e4 93 c0 83  c0 82 12 00  01 28 75 93  00 d0 82 d0  83 a3 09 e9  .....................(u.........        21.1.160      
                         70 01 0a df  e7 de e5 80  bb 54 c0 25  e0 60 2b 40  89 e4 93 a3  fa e4 93 a3  f8 e4 93 a3  c8 c5 82 c8  p........T.%.`+@................        21.1.192      
                         ca c5 83 ca  75 93 00 f0  75 93 00 a3  c8 c5 82 c8  ca c5 83 ca  df e3 de e1  80 8a e4 93  a3 f8 e4     ....u...u......................         21.1.224      
  27         255  OUT    02 ff 0f fa  00 01 00 f6  80 93 a3 40  03 f6 80 01  f2 08 df f4  02 00 06 35  43 af 10 d2  b4 c2 b4 75  ...........@...........5C......u        22.1.0        
                         c7 aa 75 c7  55 75 9d 02  90 01 1f 70  e4 f0 90 01  04 e8 74 23  f0 90 01 04  e9 74 40 f0  74 19 14 70  ..u.Uu.....p......t#.....t@.t..p        22.1.32       
                         fd 90 01 04  ea e0 f8 90  01 04 eb e0  f9 90 00 01  03 e8 f0 a3  e9 f0 90 01  04 e8 74 26  f0 90 01 04  ..........................t&....        22.1.64       
                         e9 74 40 f0  74 19 14 70  fd 90 01 04  ea e0 f8 90  01 04 eb e0  f9 90 00 01  01 e8 f0 a3  e9 f0 90 01  .t@.t..p........................        22.1.96       
                         04 e6 74 f0  f0 90 01 04  e7 74 1f f0  90 01 04 e8  74 21 f0 90  01 04 e9 74  80 f0 74 19  14 70 fd 90  ..t......t......t!.....t..t..p..        22.1.128      
                         01 04 e6 74  00 f0 90 01  04 e7 74 c8  f0 90 01 04  e8 74 01 f0  90 01 04 e9  74 80 f0 74  19 14 70 fd  ...t......t......t......t..t..p.        22.1.160      
                         90 01 04 e6  74 00 f0 90  01 04 e7 74  80 f0 90 01  04 e8 74 1d  f0 90 01 04  e9 74 80 f0  74 19 14 70  ....t......t......t......t..t..p        22.1.192      
                         fd 90 01 04  e6 74 fa f0  90 01 04 e7  74 1f f0 90  01 04 e8 74  21 f0 90 01  04 e9 74 80  f0 74 19     .....t......t......t!.....t..t.         22.1.224      
  27         255  OUT    02 ff 0f fa  00 01 00 f6  80 14 70 fd  90 01 04 e6  74 f0 f0 90  01 04 e7 74  1f f0 90 01  04 e8 74 21  ..........p.....t......t......t!        23.1.0        
                         f0 90 01 04  e9 74 80 f0  90 01 1d 09  e0 54 07 78  1f f6 75 20  00 d2 05 e4  90 00 01 00  f0 43 af 10  .....t.......T.x..u .........C..        23.1.32       
                         d2 b4 c2 b4  d2 b4 c2 b4  90 01 1f 70  74 03 f0 75  d0 00 78 ff  79 df e4 f6  18 d9 fc 78  1e f6 d8 fd  ...........pt..u..x.y......x....        23.1.64       
                         78 00 7f 00  e4 f2 08 df  fc 90 00 01  05 7f fb 7e  ff e4 f0 a3  df fc de fa  90 00 00 00  78 10 74 55  x...........................x.tU        23.1.96       
                         f0 a3 d8 fc  75 81 ff 02  00 06 31 41  6d f3 55 41  6d f1 00 41  6d f4 e0 41  6d f2 01 41  6d fd 00 43  ....u.....1Am.UAm..Am..Am..Am..C        23.1.128      
                         6e 96 85 56  e9 43 6d eb  55 55 55 41  6d ee 00 41  6e b0 00 41  6e af ff 60  20 66 10 00  00 10 81 21  n..V.Cm.UUUAm..An..An..` f.....!        23.1.160      
                         02 31 83 42  04 52 85 63  06 73 87 84  08 94 89 a5  0a b5 8b c6  0c d6 8d e7  0e f7 8f 4b  67 20 42 55  .1.B.R.c.s.................Kg BU        23.1.192      
                         55 ff ff ff  ff 00 00 00  00 4b 66 05  42 55 55 ff  ff ff ff ff  ff ff ff 60  f0 66 30 00  00 00 00     U........Kf.BUU........`.f0....         23.1.224      
  27          80  IN     04 13 05 01  ff 0f 01 00  02 ff 0f 06  00 01 00 02  00 00 00 04  13 05 01 ff  0f 01 00 02  ff 0f 06 00  ................................        24.1.0        
                         01 00 02 00  00 00 04 13  05 01 ff 0f  01 00 02 ff  0f 06 00 01  00 02 00 00  00 04 13 05  01 ff 0f 01  ................................        24.1.32       
                         00 02 ff 0f  06 00 01 00  02 00 00 00  04 13 05 01                                                      ................                        24.1.64       
  27          53  IN     ff 0f 01 00  02 ff 0f 06  00 01 00 02  00 00 00 04  13 05 01 ff  0f 01 00 02  ff 0f 06 00  01 00 02 00  ................................        25.1.0        
                         00 00 04 13  05 01 ff 0f  01 00 02 ff  0f 06 00 01  00 02 00 00  00                                     .....................                   25.1.32       
  27          19  IN     04 13 05 01  ff 0f 01 00  02 ff 0f 06  00 01 00 02  00 00 00                                            ...................                     26.1.0        
  27         255  OUT    02 ff 0f fa  00 01 00 f6  80 01 01 00  00 20 00 01  04 00 00 40  00 01 10 00  00 60 00 01  40 00 00 80  ............. .....@.....`..@...        27.1.0        
                         00 02 40 00  01 00 00 05  01 00 02 00  00 05 02 00  03 00 00 05  04 00 04 00  00 05 08 00  05 00 00 05  ..@.............................        27.1.32       
                         10 00 06 00  00 05 20 00  07 00 00 05  40 00 08 00  00 05 80 00  09 00 00 04  01 00 0a 00  00 04 02 00  ...... .....@...................        27.1.64       
                         0b 00 00 04  04 00 0c 00  00 04 08 00  0d 00 00 04  10 00 0e 00  00 04 20 00  0f 00 00 04  40 00 10 00  ...................... .....@...        27.1.96       
                         00 04 80 00  11 00 00 03  01 00 12 00  00 03 02 00  13 00 00 03  04 00 14 00  00 03 08 00  15 00 00 03  ................................        27.1.128      
                         10 00 16 00  00 03 20 00  17 00 00 03  40 00 18 00  00 03 80 00  19 00 00 02  01 00 1a 00  00 02 02 00  ...... .....@...................        27.1.160      
                         1b 00 00 02  04 00 1c 00  00 02 08 00  1d 00 00 02  10 00 1e 00  00 02 20 00  1f 00 00 02  80 00 1f 80  ...................... .........        27.1.192      
                         00 00 01 00  1f a0 00 00  04 00 1f c0  00 00 10 00  1f e0 00 00  40 41 6c 00  00 44 6e 5b  00 00 00     ....................@Al..Dn[...         27.1.224      
  27         255  OUT    02 ff 0f fa  00 01 00 f6  80 00 44 6e  5f 00 00 00  00 82 e3 00  00 52 62 89  00 00 00 00  00 00 00 00  ..........Dn_........Rb.........        28.1.0        
                         00 00 00 00  00 00 00 00  00 00 00 c0  d0 c0 e0 30  36 06 20 01  03 53 a4 df  c0 f0 c0 86  c0 93 c0 83  ...............06. ..S..........        28.1.32       
                         c0 82 c0 95  c0 85 c0 84  75 d0 08 75  86 00 12 00  c9 4f 30 5f  4b d0 84 d0  85 d0 95 d0  82 d0 83 d0  ........u..u.....O0_K...........        28.1.64       
                         93 d0 86 d0  f0 d0 e0 d0  d0 32 c0 d0  c0 e0 c0 f0  c0 86 c0 93  c0 83 c0 82  c0 95 c0 85  c0 84 75 d0  .........2....................u.        28.1.96       
                         08 75 86 00  12 04 05 63  30 5e 15 d0  84 d0 85 d0  95 d0 82 d0  83 d0 93 d0  86 d0 f0 d0  e0 d0 d0 32  .u.....c0^.....................2        28.1.128      
                         75 d0 00 c0  00 c0 01 c0  02 c0 03 c0  04 c0 05 c0  06 c0 07 20  5e 36 74 4c  c0 e0 74 0a  c0 e0 74 00  u.................. ^6tL..t...t.        28.1.160      
                         c0 e0 32 12  03 83 1f d0  07 d0 06 d0  05 d0 04 d0  03 d0 02 d0  01 d0 00 d0  84 d0 85 d0  95 d0 82 d0  ..2.............................        28.1.192      
                         83 d0 93 d0  86 d0 f0 d0  e0 d0 d0 22  74 82 c0 e0  74 0a c0 e0  74 00 c0 e0  32 12 03 ea  41 d0 07     ..........."t...t...t...2...A..         28.1.224      
  27         255  OUT    02 ff 0f fa  00 01 00 f6  80 d0 06 d0  05 d0 04 d0  03 d0 02 d0  01 d0 00 d0  84 d0 85 d0  95 d0 82 d0  ................................        29.1.0        
                         83 d0 93 d0  86 d0 f0 d0  e0 d0 d0 22  32 c0 00 c0  e0 c0 d0 d0  d0 d0 e0 d0  00 32 32 c0  d0 c0 e0 c0  ..........."2............22.....        29.1.32       
                         f0 c0 86 c0  93 c0 83 c0  82 c0 95 c0  85 c0 84 75  d0 08 75 86  00 12 04 4e  15 d0 84 d0  85 d0 95 d0  ...............u..u....N........        29.1.64       
                         82 d0 83 d0  93 d0 86 d0  f0 d0 e0 d0  d0 32 74 80  55 a8 70 04  02 03 7d ec  c2 af 12 03  7d ec d2 af  .............2t.U.p.............        29.1.96       
                         22 74 80 55  a8 70 04 02  04 0d a9 c2  af 12 04 0d  a9 d2 af 22  74 80 55 a8  70 04 02 04  12 99 c2 af  "t.U.p............."t.U.p.......        29.1.128      
                         12 04 12 99  d2 af 22 74  80 55 a8 70  04 02 04 40  42 c2 af 12  04 40 42 d2  af 22 74 80  55 a8 70 04  ......"t.U.p...@B....@B.."t.U.p.        29.1.160      
                         02 04 40 70  c2 af 12 04  40 70 d2 af  22 74 80 55  a8 70 04 02  04 40 9e c2  af 12 04 40  9e d2 af 22  ..@p....@p.."t.U.p...@.....@..."        29.1.192      
                         74 80 55 a8  70 04 02 04  36 af c2 af  12 04 36 af  d2 af 22 74  80 55 a8 70  04 02 04 36  e9 c2 af     t.U.p...6.....6..."t.U.p...6...         29.1.224      
  27         255  OUT    02 ff 0f fa  00 01 00 f6  80 12 04 36  e9 d2 af 22  74 80 55 a8  70 04 02 04  37 23 c2 af  12 04 37 23  ...........6..."t.U.p...7#....7#        30.1.0        
                         d2 af 22 74  80 55 a8 70  04 02 03 30  4c c2 af 12  03 30 4c d2  af 22 74 80  55 a8 70 04  02 03 23 5b  .."t.U.p...0L....0L.."t.U.p...#[        30.1.32       
                         c2 af 12 03  23 5b d2 af  22 74 80 55  a8 70 04 02  03 4b 06 c2  af 12 03 4b  06 d2 af 22  74 80 55 a8  ....#[.."t.U.p...K.....K..."t.U.        30.1.64       
                         70 04 02 03  6c a3 c2 af  12 03 6c a3  d2 af 22 74  80 55 a8 70  04 02 03 e3  ee c2 af 12  03 e3 ee d2  p...l.....l..."t.U.p............        30.1.96       
                         af 22 74 80  55 a8 70 04  02 04 1d fc  c2 af 12 04  1d fc d2 af  22 74 80 55  a8 70 04 02  04 3d a4 c2  ."t.U.p............."t.U.p...=..        30.1.128      
                         af 12 04 3d  a4 d2 af 22  d3 10 af 01  c3 c0 d0 ed  f5 e9 ec f5  ea ef f5 eb  ee f5 ec eb  f5 ed ea f5  ...=..."........................        30.1.160      
                         ee 74 04 14  00 70 fc e5  e9 ff e5 ea  fe e5 eb fd  e5 ec fc e5  ed e5 ee d0  d0 92 af 22  d3 10 af 01  .t...p....................."....        30.1.192      
                         c3 c0 d0 ed  f5 e9 ec f5  ea ef f5 eb  ee f5 ec eb  f5 ed ea f5  ee 74 04 14  00 70 fc e5  e9 e5 ea     .....................t...p.....         30.1.224      
  27         255  OUT    02 ff 0f fa  00 01 00 f6  80 e5 eb e5  ec e5 ed ff  e5 ee fe d0  d0 92 af 22  d3 10 af 01  c3 c0 d0 ef  ......................."........        31.1.0        
                         f5 e9 ed f5  ed ee f5 ea  ec f5 ee 74  02 14 00 70  fc 00 e5 e9  ff e5 ea fe  e5 eb fd e5  ec fc d0 d0  ...........t...p................        31.1.32       
                         92 af 22 8e  85 8f 84 75  95 00 8c 83  8d 82 75 93  00 ea 70 03  eb 60 15 eb  60 03 ea 04  fa e4 93 a3  .."....u......u...p..`..`.......        31.1.64       
                         75 86 01 f0  a3 75 86 00  db f3 da f1  22 8e 85 8f  84 75 95 00  8c 83 8d 82  75 93 00 ea  70 03 eb 60  u....u......"....u......u...p..`        31.1.96       
                         14 eb 60 03  ea 04 fa e0  a3 75 86 01  f0 a3 75 86  00 db f4 da  f2 22 d3 10  af 01 c3 c0  d0 ef f5 e9  ..`......u....u......"..........        31.1.128      
                         ee f5 ea ed  f5 ed ec f5  ee 74 02 14  00 70 fc e5  e9 ff e5 ea  fe e5 ed e5  ee d0 d0 92  af 22 d3 10  .........t...p..............."..        31.1.160      
                         af 01 c3 c0  d0 ef f5 e9  ee f5 ea ed  f5 ed ec f5  ee 74 02 14  00 70 fc e5  e9 e5 ea e5  ed ff e5 ee  .................t...p..........        31.1.192      
                         fe d0 d0 92  af 22 8e 85  8f 84 75 95  00 8c 83 8d  82 75 93 00  af 03 1b ef  60 10 e0 a3  ff 75 86     ....."....u......u......`....u.         31.1.224      
  27         255  OUT    02 ff 0f fa  00 01 00 f6  80 01 e0 a3  75 86 00 6f  60 ec d3 22  c3 22 8e 85  8f 84 75 95  00 8c 83 8d  ............u..o`.."."....u.....        32.1.0        
                         82 75 93 00  eb 60 12 1b  e4 93 a3 ff  75 86 01 e0  a3 75 86 00  6f 60 ed d3  22 c3 22 8e  85 8f 84 75  .u...`......u....u..o`.."."....u        32.1.32       
                         95 00 8c 83  8d 82 75 93  00 eb 60 0d  e4 93 a3 75  86 01 f0 a3  75 86 00 db  f3 22 75 95  00 8e 85 8f  ......u...`....u....u...."u.....        32.1.64       
                         84 75 93 00  8c 83 8d 82  eb 60 0c e0  a3 75 86 01  f0 a3 75 86  00 db f4 22  d2 5e 12 03  f5 5b c2 5e  .u.......`...u....u....".^...[.^        32.1.96       
                         22 d2 5e 12  04 16 94 c2  5e 22 02 04  1a 5d 02 03  33 19 8e 83  8f 82 75 93  00 e0 24 01  f0 a3 e0 ff  ".^.....^"...]..3.....u...$.....        32.1.128      
                         e4 3f dd f8  54 7f f0 22  74 0f c0 e0  74 00 c0 e0  32 1d 01 00  00 00 00 00  00 00 00 00  00 00 00 00  .?..T.."t...t...2...............        32.1.160      
                         00 3f 00 01  00 00 00 00  00 00 00 00  00 00 00 00  00 db 00 00  01 00 00 00  00 00 00 00  00 00 00 00  .?..............................        32.1.192      
                         00 af 00 00  00 01 00 00  00 00 00 00  00 00 00 00  00 39 00 00  00 00 01 00  00 00 00 00  00 00 00     .................9.............         32.1.224      
  27         255  OUT    02 ff 0f fa  00 01 00 f6  80 00 00 91  02 00 00 00  00 01 00 00  00 00 00 00  00 00 00 95  00 00 00 00  ................................        33.1.0        
                         00 00 01 00  00 00 00 00  00 00 00 1b  00 00 00 00  00 00 00 01  00 00 00 00  00 00 00 09  06 00 00 00  ................................        33.1.32       
                         00 00 00 00  01 00 00 00  00 00 00 15  02 00 00 00  00 00 00 00  00 01 00 00  00 00 00 3b  01 00 00 00  ...........................;....        33.1.64       
                         00 00 00 00  00 00 01 00  00 00 00 dd  00 00 00 00  00 00 00 00  00 00 00 01  00 00 00 9d  04 00 00 00  ................................        33.1.96       
                         00 00 00 00  00 00 00 00  01 00 00 4f  01 00 00 00  00 00 00 00  00 00 00 00  00 01 00 e7  00 00 00 00  ...........O....................        33.1.128      
                         00 00 00 00  00 00 00 00  00 00 01 8f  b0 6c bf 9b  8b 92 cf d4  18 d2 ab a0  75 e2 00 ef  ef f6 cf 58  .............l..........u......X        33.1.160      
                         c2 18 7f b3  59 76 3d f6  e3 01 00 8b  80 19 19 5a  0a 03 b1 3a  6c 6c f6 be  01 00 00 d9  6a 73 d3 7f  ....Yv=........Z...:ll......js..        33.1.192      
                         46 17 de 69  99 b8 6a 01  00 00 00 47  52 71 55 ec  50 da 91 32  06 63 01 00  00 00 00 11  83 46 54     F..i..j....GRqU.P..2.c.......FT         33.1.224      
  27         179  OUT    02 ff 0f ae  00 01 00 aa  00 c0 6c aa  52 93 2c 00  00 00 00 00  00 73 a0 f3  79 e2 fc ff  f7 b3 00 00  ..........l.R.,......s..y.......        34.1.0        
                         00 00 00 00  00 25 80 ec  c7 5b 81 ab  a1 00 00 00  00 00 00 00  00 4d b0 d8  11 80 c9 02  00 00 00 00  .....%...[...........M..........        34.1.32       
                         00 00 00 00  00 bb a4 f9  24 8e 05 00  00 00 00 00  00 00 00 00  00 d7 24 60  a7 0c 00 00  00 00 00 00  ........$.............$`........        34.1.64       
                         00 00 00 00  00 b9 26 9c  1c 00 00 00  00 00 00 00  00 00 00 00  00 e3 d9 26  00 00 00 00  00 00 00 00  ......&................&........        34.1.96       
                         00 00 00 00  00 77 43 00  00 00 00 00  00 00 00 00  00 00 00 00  00 89 00 00  00 00 00 00  00 00 00 00  .....wC.........................        34.1.128      
                         00 00 00 00  00 07 0b 0d  11 13 17 4f  53 59 61 65  67 22 22                                            ...........OSYaeg""                     34.1.160      
  27          80  IN     04 13 05 01  ff 0f 01 00  02 ff 0f 06  00 01 00 02  00 00 00 04  13 05 01 ff  0f 01 00 02  ff 0f 06 00  ................................        35.1.0        
                         01 00 02 00  00 00 04 13  05 01 ff 0f  01 00 02 ff  0f 06 00 01  00 02 00 00  00 04 13 05  01 ff 0f 01  ................................        35.1.32       
                         00 02 ff 0f  06 00 01 00  02 00 00 00  04 13 05 01                                                      ................                        35.1.64       
  27          69  IN     ff 0f 01 00  02 ff 0f 06  00 01 00 02  00 00 00 04  13 05 01 ff  0f 01 00 02  ff 0f 06 00  01 00 02 00  ................................        36.1.0        
                         00 00 04 13  05 01 ff 0f  01 00 02 ff  0f 06 00 01  00 02 00 00  00 04 13 05  01 ff 0f 01  00 02 ff 0f  ................................        36.1.32       
                         06 00 01 00  02                                                                                         .....                                   36.1.64       
  27           3  IN     00 00 00                                                                                                ...                                     37.1.0        
nonono wrongwrongwrong fff
aa